{
  "schemaVersion": 1,
  "generatedAt": 1000000,
  "meshRevision": "sha256:80e84b06e940e7b718d54d79ddba870582fb0b7971b660c5cf02bf1fba29864c",
  "localHostId": "alpha",
  "sshPolicy": {
    "executable": "ssh",
    "connectTimeoutSeconds": 3,
    "connectionAttempts": 2,
    "routeHealthTtlSeconds": 300
  },
  "hosts": [
    {
      "id": "alpha",
      "display": "Alpha",
      "local": true,
      "aliases": ["alpha-native", "alpha.example", "alpha"],
      "routes": []
    },
    {
      "id": "beta",
      "display": "Beta",
      "local": false,
      "aliases": ["beta-native"],
      "routes": [
        {
          "destination": "beta-vpn.test",
          "configuredIndex": 0,
          "lastReachableAt": null,
          "lastUnreachableAt": null
        },
        {
          "destination": "beta-lan.test",
          "configuredIndex": 1,
          "lastReachableAt": null,
          "lastUnreachableAt": null
        }
      ]
    },
    {
      "id": "gamma",
      "display": "Gamma",
      "local": false,
      "aliases": ["gamma-native"],
      "routes": [
        {
          "destination": "gamma.test",
          "configuredIndex": 0,
          "lastReachableAt": null,
          "lastUnreachableAt": null
        }
      ]
    }
  ]
}
